Name,Handle,Timestamp,Verified,Content,Comments,Retweets,Likes,Analytics,Tags,Mentions,Emojis,Profile Image,Tweet Link,Tweet ID
Michael Delizo,@michael_delizo,2025-05-07T04:05:34.000Z,False,"WATCH: The Philippine National Police on Wednesday, May 7, activated the National Election Monitoring Action Center for real-time monitoring and coordination with all PNP units nationwide to ensure the orderly conduct of the mid-term polls. #Halalan2025 #SelfiePatrol",0,6,78,2.3K,"['#Halalan2025', '#SelfiePatrol']",[],[],https://pbs.twimg.com/profile_images/1712158590067425280/Jb_umN_r_bigger.jpg,https://x.com/michael_delizo/status/1919966812655255689,tweet_id:1919966812655255689
Detective Mask 名探偵マスク,@DetectiveMask,2025-05-07T03:03:11.000Z,False,"If Kiko does not do well in 2025, I hope he would at least give 2028 a chance.

Akala nga natin deds na ang Senate career ni Tito Sotto nung nag-#19 in 2007, malayong-malayo sa #1 in 1992 & #3 in 1998.

And yet, nakabawi siya, at ngayon, makakapag-5th term pa nga.#Halalan2025",14,15,191,7.1K,['#Halalan2025'],[],[],https://pbs.twimg.com/profile_images/1953317529147064321/FvP6R5yU_bigger.jpg,https://x.com/DetectiveMask/status/1919951116152013255,tweet_id:1919951116152013255
Detective Mask 名探偵マスク,@DetectiveMask,2025-05-06T06:02:11.000Z,False,"I hope rabid Kakampinks are happy now kasi unti-unti na itong nagkakatotoo.

Enjoy the impending Philip Salvador presidency. #Halalan2025",5,9,41,3.8K,['#Halalan2025'],[],[],https://pbs.twimg.com/profile_images/1953317529147064321/FvP6R5yU_bigger.jpg,https://x.com/DetectiveMask/status/1919633773848899988,tweet_id:1919633773848899988
Detective Mask 名探偵マスク,@DetectiveMask,2025-05-05T07:29:32.000Z,False,"As long as Senate elections in the Philippines are conducted this way, this is gonna keep going on and on and on.

Popularity and name recognition trumps everything else. And if Phillip Salvador wins this year, he's practically guaranteed a 12-year term as Senator.#Halalan2025",3,9,48,4K,['#Halalan2025'],[],[],https://pbs.twimg.com/profile_images/1953317529147064321/FvP6R5yU_bigger.jpg,https://x.com/DetectiveMask/status/1919293369248887200,tweet_id:1919293369248887200
Detective Mask 名探偵マスク,@DetectiveMask,2025-04-13T04:21:08.000Z,False,"In Cebu, Governor Gwen Garcia has endorsed the following admin Senate bets:

-Abalos
-Bong Revilla
-Cayetano
-Lacson
-Pacquiao 
-Sotto-Tolentino
-Villar

Unclear if she plans to endorse Binay, Lapid, & Erwin Tulfo, or goes for KikoBam and/or pro-Duterte bets.#Halalan2025",7,7,69,4.7K,['#Halalan2025'],[],[],https://pbs.twimg.com/profile_images/1953317529147064321/FvP6R5yU_bigger.jpg,https://x.com/DetectiveMask/status/1911273421872435341,tweet_id:1911273421872435341
Linedun,@KuysManskie,2025-04-11T03:05:46.000Z,False,"Ang pagboto kay Philip Salvador at Willie Revillame this 2025 ay senyales na di tayo natuto kay Robin Padilla noong 2022. Para tayong sirang plaka, paulit-ulit na lang. Nakakainit ng ulo. #VoteWisely this May. #Halalan2025",57,1.3K,3.7K,107K,"['#VoteWisely', '#Halalan2025']",[],[],https://pbs.twimg.com/profile_images/1940033244885295104/c09H1_eB_bigger.jpg,https://x.com/KuysManskie/status/1910529679813206128,tweet_id:1910529679813206128
ABS-CBN News,@ABSCBNNews,2025-04-10T04:10:54.000Z,True,"DSWD confirms video of exploited PWD in smear campaign vs Pasig Mayor Vico Sotto was taken inside St. Gerrard Construction’s office in Pasig City.  

SGC is owned by Sarah Discaya, who is running for Pasig City Mayor vs Sotto in #Halalan2025 #ANCHeadstart | via ",49,166,676,92K,"['#Halalan2025', '#ANCHeadstart']",['@_katrinadomingo'],[],https://pbs.twimg.com/profile_images/1414904727674920961/aRgHKXj5_bigger.jpg,https://x.com/ABSCBNNews/status/1910183684067705062,tweet_id:1910183684067705062
Kat Domingo,@_katrinadomingo,2025-04-10T02:54:22.000Z,False,"DSWD confirms video of exploited PWD in smear campaign vs Pasig Mayor  was taken inside St. Gerrard Construction’s office in Pasig City.

SGC is owned by Sarah Discaya, who is running for Pasig City Mayor vs Sotto in #Halalan2025 #ANCHeadstart",27,174,624,112K,"['#Halalan2025', '#ANCHeadstart']",['@VicoSotto'],[],https://pbs.twimg.com/profile_images/1901671693984407552/5GxkrDTk_bigger.jpg,https://x.com/_katrinadomingo/status/1910164422930370732,tweet_id:1910164422930370732
ABS-CBN News,@ABSCBNNews,2025-04-05T02:38:05.000Z,True,Pasig City Mayor Vico Sotto shrugs off allegations that he and his allies are behind the viral video of an opposition congressional candidate joking about a 'sex for solo parents program' in the city. | via  #Halalan2025,57,167,1.7K,192K,['#Halalan2025'],['@_katrinadomingo'],[],https://pbs.twimg.com/profile_images/1414904727674920961/aRgHKXj5_bigger.jpg,https://x.com/ABSCBNNews/status/1908348387457634368,tweet_id:1908348387457634368
Kat Domingo,@_katrinadomingo,2025-04-05T02:36:04.000Z,False,Pasig Mayor Vico Sotto shrugs off allegations that he and his allies are behind the viral video of an opposition congressional candidate joking about a  sex for solo parents program in the city.#Halalan2025,9,19,128,21K,['#Halalan2025'],[],[],https://pbs.twimg.com/profile_images/1901671693984407552/5GxkrDTk_bigger.jpg,https://x.com/_katrinadomingo/status/1908347879884022245,tweet_id:1908347879884022245
Detective Mask 名探偵マスク,@DetectiveMask,2025-03-30T16:15:50.000Z,False,"Those pushing for Vico Sotto to run for President/VP in 2028 are just as annoying as the ones floating a prez/VP run for Antonio Trillanes back in 2010.

Read the fine print po. Di pa qualified ang edad ni Trillanes  noon, at di pa qualified si Vico sa 2028.#Halalan2025",6,7,96,4.3K,['#Halalan2025'],[],[],https://pbs.twimg.com/profile_images/1953317529147064321/FvP6R5yU_bigger.jpg,https://x.com/DetectiveMask/status/1906379851696857327,tweet_id:1906379851696857327
ABS-CBN News,@ABSCBNNews,2025-03-26T08:00:00.000Z,True,WATCH: PNP spokesperson Jean Fajardo clarifies that the removal of two police officers assigned to Senator Ronald dela Rosa was in accordance with a resolution from the Comelec. #Halalan2025 | via ,49,25,194,37K,['#Halalan2025'],['@michael'],[],https://pbs.twimg.com/profile_images/1414904727674920961/aRgHKXj5_bigger.jpg,https://x.com/ABSCBNNews/status/1904805523297624158,tweet_id:1904805523297624158
Detective Mask 名探偵マスク,@DetectiveMask,2025-02-20T09:28:32.000Z,False,"Aside from Maja Salvador's endorsement of Solid North partylist, her husband Rambo Ortega is the 2nd nominee of PBA partylist. 

Really makes you wonder what's going on with these showbiz endorsements.#Halalan2025",1,6,37,5K,['#Halalan2025'],[],[],https://pbs.twimg.com/profile_images/1953317529147064321/FvP6R5yU_bigger.jpg,https://x.com/DetectiveMask/status/1892506615632322662,tweet_id:1892506615632322662
Thirty One Million,@31milmovement,2025-02-14T20:24:59.000Z,True,"Quick Question: Kapag pinalakpakan ni Michael Yang, iboboto mo ba siya? Same question applies to Bong Go.#SayNOtoPROCHINA this coming #Halalan2025 

Iboboto mo ba siya? YES OR NO.",41,11,51,2.4K,"['#SayNOtoPROCHINA', '#Halalan2025']",[],[],https://pbs.twimg.com/profile_images/1546719549881745409/mGVKFfP8_bigger.jpg,https://x.com/31milmovement/status/1890497489641349242,tweet_id:1890497489641349242
ABS-CBN News,@ABSCBNNews,2025-02-11T05:20:00.000Z,True,"Para kay dating Senate President Vicente “Tito” Sotto III, patunay ang kaniyang record sa mahigit dalawang dekada niyang paglilingkod noon sa Senado.

Ngayong #Halalan2025, humihiling siya ng comeback. Kilatisin ang mga nais niya pang gawin sa Harapan 2025, na mapanonood sa",85,18,44,21K,['#Halalan2025'],[],[],https://pbs.twimg.com/profile_images/1414904727674920961/aRgHKXj5_bigger.jpg,https://x.com/ABSCBNNews/status/1889182577199874077,tweet_id:1889182577199874077
Kulotissima,@kulotissima,2025-02-11T03:16:11.000Z,True,"Iwan niyo na sina Sotto at Revillame sa showbiz.

Susmaryosep Pilipinas. 
Stop making the Senate the retirement home ng mga laos na artista.  #Halalan2025",2,17,41,2.9K,['#Halalan2025'],[],['\\U0001f62b'],https://pbs.twimg.com/profile_images/1527492412058255373/CLTqBpMD_bigger.jpg,https://x.com/kulotissima/status/1889151418709504454,tweet_id:1889151418709504454
ABS-CBN News Channel,@ANCALERTS,2025-02-11T03:00:01.000Z,True,"Humihiling ng comeback ang dating Senate president na si Vicente “Tito” Sotto III ngayong #Halalan2025.

Alamin ang mga gusto niya pang gawin sa Senado sa pagsalang niya sa Harapan 2025, panoorin sa ABS-CBN News Channel, ngayong Martes, Pebrero 11, ala-1:30 ng hapon at may replay",97,110,31,136K,['#Halalan2025'],[],[],https://pbs.twimg.com/profile_images/1414916108289601540/v8USByp8_bigger.jpg,https://x.com/ANCALERTS/status/1889147351232557314,tweet_id:1889147351232557314
Detective Mask 名探偵マスク,@DetectiveMask,2025-02-05T09:45:12.000Z,False,"Out of the 21 Senator-Judges who served in the Estrada impeachment trial, seven later became Senator-Judges in the Corona impeachment trial. (Defensor-Santiago, Drilon, Enrile, Honasan, Legarda, Serge Osmeña, Sotto)

Only Legarda is an incumbent.#Halalan2025 #ImpeachSaraDuterte",1,2,40,4K,"['#Halalan2025', '#ImpeachSaraDuterte']",[],[],https://pbs.twimg.com/profile_images/1953317529147064321/FvP6R5yU_bigger.jpg,https://x.com/DetectiveMask/status/1887074991558255002,tweet_id:1887074991558255002
Kulotissima,@kulotissima,2025-01-31T12:39:36.000Z,True,"Pag Tuta ni Duterte, Tuta ng China.
The Senate under Tito Sotto’s embarrassing leadership caved to Duterte. 

Kulang na lang kumahol na parang mga aso ang karamihan ng mga nakaupong Senador noong panahon ni Duterte. 

Huwag iboto ang  mga Hudas na ‘to.#Halalan2025",0,21,39,1K,['#Halalan2025'],[],[],https://pbs.twimg.com/profile_images/1527492412058255373/CLTqBpMD_bigger.jpg,https://x.com/kulotissima/status/1885306941582328042,tweet_id:1885306941582328042
ABS-CBN News,@ABSCBNNews,2025-01-31T12:00:03.000Z,True,Harapan 2025: Sotto pushes for PH-China ‘joint venture’ in West PH Sea #Halalan2025,157,147,103,173K,['#Halalan2025'],[],[],https://pbs.twimg.com/profile_images/1414904727674920961/aRgHKXj5_bigger.jpg,https://x.com/ABSCBNNews/status/1885296987576426878,tweet_id:1885296987576426878
Detective Mask 名探偵マスク,@DetectiveMask,2025-01-04T14:56:26.000Z,False,"Just a realization.

If Tito Sotto gets re-elected to the Senate in 2025, that might make Vico Sotto immediately reject a Senate bid from 2028 up until the year Tito is no longer in the Senate (which could be as far as the year 2037).#Halalan2025",5,10,49,3.9K,['#Halalan2025'],[],[],https://pbs.twimg.com/profile_images/1953317529147064321/FvP6R5yU_bigger.jpg,https://x.com/DetectiveMask/status/1875556902412910917,tweet_id:1875556902412910917
Detective Mask 名探偵マスク,@DetectiveMask,2024-12-09T02:47:07.000Z,False,"Seryoso, anyare kay Philip Salvador? Pinilit nilang patakbuhin, pero di nila sinali sa TV ad nila.

Ginawang abandonadong tuta ang dating action star. #Halalan2025",10,22,123,6K,['#Halalan2025'],[],[],https://pbs.twimg.com/profile_images/1953317529147064321/FvP6R5yU_bigger.jpg,https://x.com/DetectiveMask/status/1865951278729511042,tweet_id:1865951278729511042
ABS-CBN News,@ABSCBNNews,2024-10-28T11:00:01.000Z,True,"Pasig City Mayor Vico Sotto submitted a letter to Comelec that outlined concerns about Sarah Discaya's candidacy for mayor due to her connections with a construction firm that may impact election credibility. #Halalan2025 

READ: news.abs-cbn.com/news/2024/10/2
…",1,14,69,14K,['#Halalan2025'],[],[],https://pbs.twimg.com/profile_images/1414904727674920961/aRgHKXj5_bigger.jpg,https://x.com/ABSCBNNews/status/1850855033409061205,tweet_id:1850855033409061205
Claire,@claireyu,2024-10-17T13:48:16.000Z,False,"Who would forget this press conference by Isko Moreno, Ping Lacson, Tito Sotto, Norberto Nograles, and Doc Willie Ong to stop FVP Leni Robredo for running for President last 2022 elections. Then now, ito dumidikit na #trapo #Halalan2025",1,26,71,7.8K,"['#trapo', '#Halalan2025']",[],"['\\U0001f440', '\\U0001f605']",https://pbs.twimg.com/profile_images/1655575130360168449/txXIeTg4_bigger.jpg,https://x.com/claireyu/status/1846911107589722223,tweet_id:1846911107589722223
iMPACT Leadership,@iMPACTPH2019,2024-10-06T00:30:00.000Z,True,"'I WAS INSPIRED BY MY DAD TO BE INVOLVED IN POLITICS'Michael Pacquiao, son of former Senator Manny Pacquiao, acknowledged his father's influence on his decision to enter politics, emphasizing his desire to pursue his own goals. #Halalan2025",31,93,33,116K,['#Halalan2025'],[],[],https://pbs.twimg.com/profile_images/1713681702726651904/8YeAQ_vn_bigger.jpg,https://x.com/iMPACTPH2019/status/1842723949320278286,tweet_id:1842723949320278286
ABS-CBN News,@ABSCBNNews,2024-10-05T12:47:42.000Z,True,"For Vic Sotto and Coney Reyes, 'nothing to worry about' over Vico's re-election bid #Halalan2025",0,5,131,18K,['#Halalan2025'],[],[],https://pbs.twimg.com/profile_images/1414904727674920961/aRgHKXj5_bigger.jpg,https://x.com/ABSCBNNews/status/1842547209122030038,tweet_id:1842547209122030038
ABS-CBN News,@ABSCBNNews,2024-10-05T11:17:46.000Z,True,"‘YUNG MGA STYLE NA BULOK HINDI NA UUBRA SA PASIG’

Veteran actors Vic Sotto and Coney Reyes say “nothing to worry about” in son ’s third bid for Pasig’s top local post. #Halalan2025 | via ",23,252,3.8K,381K,['#Halalan2025'],"['@VicoSotto', '@_katrinadomingo']",[],https://pbs.twimg.com/profile_images/1414904727674920961/aRgHKXj5_bigger.jpg,https://x.com/ABSCBNNews/status/1842524578343735402,tweet_id:1842524578343735402
Kat Domingo,@_katrinadomingo,2024-10-05T11:11:46.000Z,False,"‘YUNG MGA STYLE NA BULOK HINDI NA UUBRA SA PASIG’

Veteran actors Vic Sotto and Coney Reyes say “nothing to worry about” in son ’s third bid for Pasig’s top local post. #Halalan2025 ",6,33,451,28K,['#Halalan2025'],"['@VicoSotto', '@ABSCBNNews', '@ANCALERTS']",[],https://pbs.twimg.com/profile_images/1901671693984407552/5GxkrDTk_bigger.jpg,https://x.com/_katrinadomingo/status/1842523067152752881,tweet_id:1842523067152752881
Dante Paule Maglaqui,@imdantemaglaqui,2024-10-05T04:09:12.000Z,False,Pasig Mayor Vico Sotto and Vice Mayor Dodot Jaworski arrive at the local Comelec office to file their Certificates of Candidacy for #Halalan2025 accompanied by parents 'Bossing' Vic Sotto and Coney Reyes in filing candidacy for reelection. The mayor will run for the last term.,0,3,46,5.5K,['#Halalan2025'],[],[],https://pbs.twimg.com/profile_images/1781246767205625856/SnWEHZVx_bigger.jpg,https://x.com/imdantemaglaqui/status/1842416724232282270,tweet_id:1842416724232282270
ABS-CBN News,@ABSCBNNews,2024-10-05T03:30:04.000Z,True,"‘THAT IS VERY STUPID TO SAY’

Pasig Mayor  scoffs at allegation he is “provoking” owners of St. Gerrard Construction to compete vs him in #Halalan2025 Sotto says cases vs SGC will continue: “I have to do my job kung sino man ang kalaban, ano man ang pulitika.” | via",1,9,24,10K,['#Halalan2025'],['@VicoSotto'],[],https://pbs.twimg.com/profile_images/1414904727674920961/aRgHKXj5_bigger.jpg,https://x.com/ABSCBNNews/status/1842406878309241225,tweet_id:1842406878309241225
Kat Domingo,@_katrinadomingo,2024-10-05T03:27:55.000Z,False,"‘THAT IS VERY STUPID TO SAY’

Pasig Mayor  scoffs at allegation he is “provoking” owners of St. Gerrard Construction to compete vs him in #Halalan2025 Sotto says cases vs SGC will continue: “I have to do my job kung sino man ang kalaban, ano man ang pulitika.”",133,1.1K,9.2K,799K,['#Halalan2025'],['@VicoSotto'],[],https://pbs.twimg.com/profile_images/1901671693984407552/5GxkrDTk_bigger.jpg,https://x.com/_katrinadomingo/status/1842406337936044401,tweet_id:1842406337936044401
ABS-CBN News,@ABSCBNNews,2024-10-04T05:25:00.000Z,True,"An official from St. Gerrard Construction is set to go against incumbent Pasig City Mayor Vico Sotto for mayoralty after Sotto ""provoked"" them with his alleged baseless attacks against the firm. #Halalan2025 

More details: news.abs-cbn.com/news/2024/10/3
…",41,20,83,28K,['#Halalan2025'],[],[],https://pbs.twimg.com/profile_images/1414904727674920961/aRgHKXj5_bigger.jpg,https://x.com/ABSCBNNews/status/1842073412765942041,tweet_id:1842073412765942041
ABS-CBN News,@ABSCBNNews,2024-10-03T15:11:39.000Z,True,"‘Same people are behind ST GERRARD CONSTRUCTION and ST TIMOTHY CONSTRUCTION’  

Pasig Mayor  says ex-partner of #Halalan2025 provider Miru Systems linked to St Gerrard Construction, owned by Sarah Discaya, his expected-rival for the mayoralty post in 2025. (: Sotto) |",5,41,60,22K,['#Halalan2025'],['@VicoSotto'],['\\U0001f4f7'],https://pbs.twimg.com/profile_images/1414904727674920961/aRgHKXj5_bigger.jpg,https://x.com/ABSCBNNews/status/1841858662840860737,tweet_id:1841858662840860737
Kat Domingo,@_katrinadomingo,2024-10-03T13:28:20.000Z,False,"‘Same people are behind ST GERRARD CONSTRUCTION and ST TIMOTHY CONSTRUCTION’

Pasig Mayor  says ex-partner of #Halalan2025 provider Miru Systems linked to St Gerrard Construction, owned by Sarah Discaya, his expected-rival for the mayoralty post in 2025.: Vico Sotto",1,13,24,5.8K,['#Halalan2025'],['@VicoSotto'],['\\U0001f4f7'],https://pbs.twimg.com/profile_images/1901671693984407552/5GxkrDTk_bigger.jpg,https://x.com/_katrinadomingo/status/1841832662157426735,tweet_id:1841832662157426735
Rappler,@rapplerdotcom,2024-10-03T04:47:50.000Z,True,"Philip Salvador faces the media after filing COC for senator

WATCH: Actor Philip Salvador addresses the media after filing a certificate of candidacy (COC) for senator at the Manila Hotel on Thursday, October 3. #PHVote #AmbagNatin #BeTheChangeGet live updates:",371,120,99,186K,"['#PHVote', '#AmbagNatin', '#BeTheChange']",[],[],https://pbs.twimg.com/profile_images/1583252893368717313/wUCmGve8_bigger.jpg,https://x.com/rapplerdotcom/status/1841701673879896182,tweet_id:1841701673879896182
ABS-CBN News,@ABSCBNNews,2024-10-02T02:52:53.000Z,True,"LOOK: Former senators ,  and reelectionist senator Lito Lapid file their certificates of candidacy at the Manila Hotel Tent City this Wednesday, October 2, 2024. #Halalan2025",91,40,47,20K,['#Halalan2025'],"['@sotto', '@iampinglacson']",[],https://pbs.twimg.com/profile_images/1414904727674920961/aRgHKXj5_bigger.jpg,https://x.com/ABSCBNNews/status/1841310354942611474,tweet_id:1841310354942611474
MJ Felipe,@mjfelipe,2024-10-01T06:28:35.000Z,True,LOOK: Re-electionist Quezon City 1st District congressman Arjo Atayde just filed his certificate of candidacy. Mayor Joy Belmonte and VM Gian Sotto joined him this afternoon. #Halalan2025,2,18,71,8.4K,['#Halalan2025'],[],[],https://pbs.twimg.com/profile_images/1758348775654084608/Hcqyoz8c_bigger.jpg,https://x.com/mjfelipe/status/1841002250824794213,tweet_id:1841002250824794213
ABS-CBN News,@ABSCBNNews,2024-10-01T06:19:15.000Z,True,"LOOK: Actor and QC 1st District Rep. Arjo Atayde is seeking reelection. 

He is joined by his mother, actress Sylvia Sanchez, QC Mayor Joy Belmonte, and Vice Mayor Gian Sotto | via  #Halalan2025",10,18,85,26K,['#Halalan2025'],['@_arraperez'],[],https://pbs.twimg.com/profile_images/1414904727674920961/aRgHKXj5_bigger.jpg,https://x.com/ABSCBNNews/status/1840999901859041296,tweet_id:1840999901859041296
Rappler,@rapplerdotcom,2024-10-01T05:30:33.000Z,True,"Quezon City Mayor Joy Belmonte is gunning for reelection as she files her certificate of candidacy on Tuesday, October 1. If she wins, Belmonte will be on her last term as mayor. She is campaigning with incumbent Vice Mayor Gian Sotto. #PHVote | via Patrick Cruz/Rappler

LIVE",2,3,17,4.1K,['#PHVote'],[],[],https://pbs.twimg.com/profile_images/1583252893368717313/wUCmGve8_bigger.jpg,https://x.com/rapplerdotcom/status/1840987647084544464,tweet_id:1840987647084544464
Kat Domingo,@_katrinadomingo,2024-10-01T05:03:15.000Z,False,NOW: Quezon City Mayor Joy Belmonte and Vice Mayor Gian Sotto file their certificates of candidacy for re-election.#Halalan2025,2,6,39,5.8K,['#Halalan2025'],[],[],https://pbs.twimg.com/profile_images/1901671693984407552/5GxkrDTk_bigger.jpg,https://x.com/_katrinadomingo/status/1840980777330446424,tweet_id:1840980777330446424
ABS-CBN News,@ABSCBNNews,2024-10-01T05:02:53.000Z,True,"LOOK: QC Mayor Joy Belmonte, Vice Mayor Gian Sotto file their certificates of candidacy. 

Also present are former House speaker Sonny Belmonte, Congressmen Arjo Atayde (1st D), Franz Pumaren (3rd D), former Senator Tito Sotto, among others. | via  #Halalan2025",6,3,28,16K,['#Halalan2025'],['@mjfelipe'],[],https://pbs.twimg.com/profile_images/1414904727674920961/aRgHKXj5_bigger.jpg,https://x.com/ABSCBNNews/status/1840980685340967075,tweet_id:1840980685340967075
iMPACT Leadership,@iMPACTPH2019,2024-09-29T15:45:50.000Z,True,"PDP FIELDS SALVADOR, DELA ROSA, GO FOR SENATE

The once-ruling Partido Demokratiko Pilipino, chaired by former President Rodrigo Duterte, has formally announced the senatorial candidacies of actor Philip Salvador and reelectionists Bato Dela Rosa and Bong Go for #Halalan2025.",72,28,28,11K,['#Halalan2025'],[],[],https://pbs.twimg.com/profile_images/1713681702726651904/8YeAQ_vn_bigger.jpg,https://x.com/iMPACTPH2019/status/1840417713287754047,tweet_id:1840417713287754047
Informed PH,@informedph2,2024-09-26T03:48:44.000Z,True,"President @ endorses the administration senatorial slate for #Eleksyon2025.
 
Benhur Abalos
Abby Binay
Pia Cayetano
Ping Lacson
Lito Lapid
Imee Marcos
Manny Pacquiao
Bong RevillaTito SottoFrancis Tolentino
Erwin Tulfo
Camille Villar#AbalosAko ctto",17,8,41,3.3K,"['#Eleksyon2025', '#AbalosAko']",['@bongbongmarcos'],[],https://pbs.twimg.com/profile_images/1961468802409119744/jB35BrRp_bigger.jpg,https://x.com/informedph2/status/1839150083625156699,tweet_id:1839150083625156699
ABS-CBN News,@ABSCBNNews,2024-09-20T14:43:19.000Z,True,"LOOK: PDP Laban announces the nomination of Senators Christopher “Bong” Go and Ronald “Bato” Dela Rosa, as well as celebrity Philip Salvador, as part of the party’s senatorial lineup in the upcoming #Halalan2025.

The party also named Senator Robin Padilla as their national",780,296,441,124K,['#Halalan2025'],[],[],https://pbs.twimg.com/profile_images/1414904727674920961/aRgHKXj5_bigger.jpg,https://x.com/ABSCBNNews/status/1837140489608548838,tweet_id:1837140489608548838
Detective Mask 名探偵マスク,@DetectiveMask,2024-09-18T07:03:17.000Z,False,"Ganito rin ang logic ng tito ko sa Mindanao.

Kapag may nagsasabi na nabudol sila, ang response naman niya ay nabudol nga sila kasi kasabwat daw ng ""dilawan"" ang nasa pwesto ngayon.

So yes, ""Nabudol"" isn't exactly the flex some might think it is.#Halalan2025",4,3,26,1.2K,['#Halalan2025'],[],[],https://pbs.twimg.com/profile_images/1953317529147064321/FvP6R5yU_bigger.jpg,https://x.com/DetectiveMask/status/1836299943012896938,tweet_id:1836299943012896938
ABS-CBN News,@ABSCBNNews,2024-08-28T05:50:00.000Z,True,"PASIG FIRST LADY REVEAL, WHEN?   

Pasig Mayor reveals when he’ll introduce the city’s first lady to put other rumors to rest.  

He also answers the question: Will Vico Sotto run for senator in #Halalan2025? | via ",26,93,753,243K,['#Halalan2025'],"['@VicoSotto', '@_katrinadomingo']",[],https://pbs.twimg.com/profile_images/1414904727674920961/aRgHKXj5_bigger.jpg,https://x.com/ABSCBNNews/status/1828671354322952389,tweet_id:1828671354322952389
ABS-CBN News Channel,@ANCALERTS,2024-08-28T05:46:01.000Z,True,"PASIG FIRST LADY REVEAL, WHEN?   

Pasig Mayor  reveals when he’ll introduce the city’s first lady to put other rumors to rest.  He also answers the question: Will Vico Sotto run for senator in #Halalan2025? | via ",8,12,80,24K,['#Halalan2025'],"['@VicoSotto', '@_katrinadomingo']",[],https://pbs.twimg.com/profile_images/1414916108289601540/v8USByp8_bigger.jpg,https://x.com/ANCALERTS/status/1828670349472579669,tweet_id:1828670349472579669
Kat Domingo,@_katrinadomingo,2024-08-28T02:57:00.000Z,False,"PASIG FIRST LADY REVEAL, WHEN? 

Pasig Mayor  reveals when he’ll introduce the city’s first lady to put other rumors to rest.

He also answers the question: Will Vico Sotto run for senator in #Halalan2025? ",10,13,62,6.9K,['#Halalan2025'],"['@VicoSotto', '@ABSCBNNews', '@ANCALERTS']",[],https://pbs.twimg.com/profile_images/1901671693984407552/5GxkrDTk_bigger.jpg,https://x.com/_katrinadomingo/status/1828627819003551990,tweet_id:1828627819003551990
ABS-CBN News,@ABSCBNNews,2024-08-12T10:27:00.000Z,True,"CONTEXT: Pasig Mayor Vico Sotto earlier said that the protesters from Quezon City are most likely recruited by St. Gerrard Construction. 

SGC is a construction company based in Pasig rumored to be fielding their own slate in the #Halalan2025. | via ",2,18,133,52K,['#Halalan2025'],['@_katrinadomingo'],[],https://pbs.twimg.com/profile_images/1414904727674920961/aRgHKXj5_bigger.jpg,https://x.com/ABSCBNNews/status/1822942857986228224,tweet_id:1822942857986228224
ABS-CBN News,@ABSCBNNews,2024-06-23T05:59:00.000Z,True,"BREAKING: NPC expels Bamban Mayor Alice Guo from party ahead of #Halalan2025   

NPC Chair Tito Sotto has accepted the recommendation of Tarlac Gov and NPC provincial chair Susan Yap to remove the controversial mayor from the party. | via ",42,106,510,52K,['#Halalan2025'],['@_katrinadomingo'],[],https://pbs.twimg.com/profile_images/1414904727674920961/aRgHKXj5_bigger.jpg,https://x.com/ABSCBNNews/status/1804756019995869311,tweet_id:1804756019995869311
Roentgen,@ronaldgem,2024-05-28T07:04:06.000Z,False,"Makati Mayor Abby Binay takes oath as a new member of the Nationalist People's Coalition (NPC) chaired by former Senate President Tito Sotto.

Cebu Gov. Gwen Garcia resigns from Partido Demokratiko Pilipino (PDP) chaired by former President Rodrigo Duterte.#Halalan2025",5,7,48,6.2K,['#Halalan2025'],[],[],https://pbs.twimg.com/profile_images/1928738836429131776/dW7AkuZ3_bigger.jpg,https://x.com/ronaldgem/status/1795350316554350857,tweet_id:1795350316554350857
